{
  "$schema": "routes-schema.json",
  "version": "3.0.0",
  "description": "Master routing table for Vanta Design Orchestrator — 200+ skill combinations",
  "total_routes": 106,
  "conflict_resolutions": [
    { "conflict": "impeccable ↔ impeccable-design-polish", "resolution": "Usar impeccable-design-polish (open-design, más reciente)" },
    { "conflict": "emil-design-eng ↔ emilkowalski-motion", "resolution": "Usar emilkowalski-motion (open-design, más reciente)" },
    { "conflict": "design-taste-frontend ↔ taste-skill", "resolution": "Usar taste-skill (open-design, más reciente)" },
    { "conflict": "redesign-existing-projects ↔ redesign-skill", "resolution": "Usar redesign-skill (open-design, más reciente)" }
  ],
  "categories": {
    "estrategia": {
      "description": "Estrategia de Negocio y Marca (Pre-Fase 0)",
      "routes": [
        { "task": "Business Model Canvas completo", "pipeline": ["strategy/business-model-design.md", "strategy/decision-hierarchy.md", "strategy/lean-design.md"], "priority": "ALTA" },
        { "task": "Brand platform desde cero", "pipeline": ["strategy/brand-platform.md", "strategy/verbal-identity.md", "strategy/sensory-identity.md"], "priority": "ALTA" },
        { "task": "Naming estratégico + legal clearance", "pipeline": ["strategy/brand-platform.md", "strategy/legal-protection.md"], "priority": "ALTA" },
        { "task": "Estrategia de color (psicología + accesibilidad)", "pipeline": ["strategy/sensory-identity.md", "ui-ux-pro-max", "ui-design"], "priority": "ALTA" },
        { "task": "Verbal identity / guía de voz y tono", "pipeline": ["strategy/verbal-identity.md", "ux-writing", "writing-guidelines"], "priority": "ALTA" },
        { "task": "Lean Design / MVP scope", "pipeline": ["strategy/lean-design.md", "strategy/business-model-design.md", "prototyping-testing"], "priority": "MEDIA" },
        { "task": "Métricas de diseño y ROI", "pipeline": ["strategy/metrics-framework.md", "design-ops/design-impact-reporting"], "priority": "MEDIA" },
        { "task": "Auditoría estratégica de marca completa", "pipeline": ["strategy/brand-platform.md", "strategy/verbal-identity.md", "visual-critique", "strategy/legal-protection.md"], "priority": "ALTA" },
        { "task": "Protección legal / trademark", "pipeline": ["strategy/legal-protection.md", "reference-design-contract"], "priority": "ALTA" },
        { "task": "Tendencias 2026", "pipeline": ["strategy/trends-2026.md", "awesome-claude-design"], "priority": "MEDIA" },
        { "task": "Identidad sensorial 360°", "pipeline": ["strategy/sensory-identity.md", "canvas-design", "algorithmic-art"], "priority": "BAJA" },
        { "task": "Sonic branding / identidad sonora", "pipeline": ["strategy/sonic-kinetic-identity.md", "strategy/brand-platform.md"], "priority": "ALTA" },
        { "task": "Kinetic typography", "pipeline": ["strategy/sonic-kinetic-identity.md", "motion"], "priority": "MEDIA" },
        { "task": "Co-branding rules", "pipeline": ["strategy/brand-operations.md", "brand-guidelines"], "priority": "ALTA" },
        { "task": "RACI matrix + SLA", "pipeline": ["strategy/brand-operations.md", "design-ops"], "priority": "MEDIA" },
        { "task": "Brand changelog", "pipeline": ["strategy/brand-operations.md", "design-md"], "priority": "BAJA" },
        { "task": "Identity stress testing", "pipeline": ["strategy/brand-operations.md", "canvas-design"], "priority": "ALTA" },
        { "task": "Elevator pitch", "pipeline": ["strategy/brand-operations.md", "strategy/brand-platform.md"], "priority": "BAJA" },
        { "task": "Estrategia de contenido / UX writing", "pipeline": ["strategy/brand-platform.md", "strategy/verbal-identity.md", "writing-guidelines", "ai-seo"], "priority": "ALTA" },
        { "task": "Estrategia de accesibilidad", "pipeline": ["strategy/accessibility-strategy.md", "ui-design", "ux-heuristics", "web-design-guidelines"], "priority": "ALTA" },
        { "task": "Métricas financieras (CASH)", "pipeline": ["strategy/metrics-framework.md", "strategy/business-model-design.md"], "priority": "ALTA" },
        { "task": "Share of Search + AI Visibility", "pipeline": ["strategy/metrics-framework.md", "ai-seo", "seo"], "priority": "ALTA" },
        { "task": "Discovery & Diagnosis de marca", "pipeline": ["strategy/brand-documentation.md", "strategy/business-model-design.md", "strategy/brand-platform.md", "strategy/legal-protection.md"], "priority": "ALTA" },
        { "task": "Brand Book aspiracional", "pipeline": ["strategy/brand-documentation.md", "strategy/brand-platform.md", "strategy/verbal-identity.md", "strategy/sensory-identity.md", "brandkit", "canvas-design"], "priority": "ALTA" },
        { "task": "MIC — Manual de Identidad Visual", "pipeline": ["strategy/brand-documentation.md", "strategy/sensory-identity.md", "ui-ux-pro-max", "design-systems", "ui-design"], "priority": "ALTA" },
        { "task": "Manual de Marca Digital", "pipeline": ["strategy/brand-documentation.md", "design-systems", "ui-design", "strategy/sensory-identity.md"], "priority": "MEDIA" },
        { "task": "Brand Kit (carpeta de activos)", "pipeline": ["strategy/brand-documentation.md", "brandkit", "canvas-design", "design-systems"], "priority": "ALTA" },
        { "task": "Decision Log de marca", "pipeline": ["strategy/brand-documentation.md", "design-md", "strategy/brand-operations.md"], "priority": "MEDIA" },
        { "task": "Validación de hipótesis de diseño (Ciclo EVP)", "pipeline": ["strategy/validation-sustainability.md", "strategy/lean-design.md", "prototype", "prototyping-testing", "strategy/metrics-framework.md"], "priority": "ALTA" },
        { "task": "Test A/B Estratégico", "pipeline": ["strategy/validation-sustainability.md", "design-research", "strategy/metrics-framework.md"], "priority": "MEDIA" },
        { "task": "5 Porqués / Causa Raíz", "pipeline": ["strategy/validation-sustainability.md", "design-research", "strategy/business-model-design.md"], "priority": "ALTA" },
        { "task": "Triple Balance (D×F×V)", "pipeline": ["strategy/validation-sustainability.md", "strategy/business-model-design.md", "strategy/decision-hierarchy.md"], "priority": "ALTA" },
        { "task": "Curaduría Humana / IA Responsable", "pipeline": ["strategy/validation-sustainability.md", "strategy/trends-2026.md", "strategy/legal-protection.md"], "priority": "ALTA" },
        { "task": "Productización del diseño", "pipeline": ["strategy/validation-sustainability.md", "strategy/brand-documentation.md"], "priority": "BAJA" },
        { "task": "PRD desde conversación / brief", "pipeline": ["to-prd", "strategy/business-model-design.md", "strategy/decision-hierarchy.md"], "priority": "ALTA" }
      ]
    },
    "ui-frontend": {
      "description": "UI / Frontend",
      "routes": [
        { "task": "Landing page from scratch", "pipeline": ["creative-director", "design-taste-frontend", "ui-ux-pro-max", "ui-design", "frontend-design", "emilkowalski-motion", "gsap-scrolltrigger", "fal-generate", "ai-seo", "impeccable-design-polish"], "priority": "ALTA" },
        { "task": "Componente UI (button, card, modal)", "pipeline": ["shadcn-ui", "interaction-design", "frontend-design", "ui-design", "emilkowalski-motion"], "priority": "ALTA" },
        { "task": "Formulario / onboarding", "pipeline": ["interaction-design", "ux-heuristics", "frontend-design", "ui-design", "login-flow"], "priority": "MEDIA" },
        { "task": "Dashboard / admin panel", "pipeline": ["platform-design", "shadcn-ui", "d3-visualization", "ui-ux-pro-max", "ui-design", "react-best-practices"], "priority": "ALTA" },
        { "task": "Página de FAQ / help center", "pipeline": ["faq-page", "ux-heuristics", "frontend-design", "ai-seo"], "priority": "BAJA" },
        { "task": "Login / auth flow", "pipeline": ["login-flow", "interaction-design", "frontend-design", "ui-design"], "priority": "MEDIA" },
        { "task": "Rediseño de landing existente", "pipeline": ["impeccable", "visual-critique", "ui-ux-pro-max", "frontend-design", "design-motion-principles", "web-design-guidelines"], "priority": "ALTA" }
      ]
    },
    "branding": {
      "description": "Branding / Identidad",
      "routes": [
        { "task": "Brand identity from zero", "pipeline": ["creative-director", "design-brief", "color-expert", "brandkit", "canvas-design", "theme-factory", "design-md"], "priority": "ALTA" },
        { "task": "Logo design", "pipeline": ["brandkit", "canvas-design", "algorithmic-art", "fal-generate", "design-md"], "priority": "ALTA" },
        { "task": "Brand guidelines PDF", "pipeline": ["brand-guidelines", "theme-factory", "pdf", "docx"], "priority": "MEDIA" },
        { "task": "Color palette", "pipeline": ["color-expert", "ui-ux-pro-max", "design-md"], "priority": "ALTA" },
        { "task": "Design review existing", "pipeline": ["design-review", "visual-critique", "impeccable-design-polish", "redesign-skill"], "priority": "ALTA" },
        { "task": "Design brief", "pipeline": ["design-brief", "creative-director", "design-md"], "priority": "MEDIA" }
      ]
    },
    "imagenes": {
      "description": "Imágenes / Multimedia",
      "routes": [
        { "task": "Generar imagen (general)", "pipeline": ["fal-generate", "imagegen", "imagen"], "priority": "ALTA" },
        { "task": "Editar imagen (inpaint, style transfer)", "pipeline": ["fal-image-edit", "venice-image-edit"], "priority": "ALTA" },
        { "task": "Upscale image/video", "pipeline": ["fal-upscale", "pixelbin-media"], "priority": "ALTA" },
        { "task": "Crear mockup 3D dispositivo", "pipeline": ["mockup-device-3d", "imagegen-frontend-web"], "priority": "ALTA" },
        { "task": "E-commerce images", "pipeline": ["ecommerce-image-workflow", "image-enhancer", "fal-tryon"], "priority": "MEDIA" },
        { "task": "Marketing screenshots", "pipeline": ["screenshots-marketing", "full-page-screenshot"], "priority": "MEDIA" }
      ]
    },
    "video": {
      "description": "Video / Animación",